{
  "image_path": "data/calibration_images/IMG_065.png",
  "product_name": "黑色眼罩",
  "category": "睡眠用品",
  "keywords": [
    "黑色",
    "眼罩",
    "柔软"
  ],
  "rigidity": "soft",
  "package_type": "OPP袋",
  "quantity": 1,
  "actual_weight_kg": null,
  "dimensions_cm": null,
  "packed_weight_kg": null,
  "packed_dimensions_cm": null,
  "compressible": true,
  "fragile": false,
  "confidence": "medium",
  "evidence": "图片显示柔软黑色眼罩，未见重量和尺寸标注",
  "notes": "示例数据，仅用于自检"
}